scenario,scenario_type,gmv_factor,net_to_gmv_factor,subsidy_rate_factor,refund_rate_factor,dispute_rate_factor,chargeback_rate_factor,risk_gap_factor,top_risk_exposure_factor,remove_bad_actor_intensity,correct_bad_actor_effectiveness,assumption_summary
baseline,reference,1.0,1.0,1.0,1.0,1.0,1.0,1.0,1.0,0.0,0.0,Status-quo run-rate continuation.
seller_quality_improvement,quality_upside,0.985,1.003,0.96,0.82,0.85,0.9,0.86,0.78,0.02,0.4,SLA enforcement + seller coaching reduce post-order leakage with small near-term GMV drag.
subsidy_tightening,policy_upside,0.955,1.012,0.72,0.93,0.96,0.98,0.95,0.92,0.01,0.25,Promo eligibility tightening lowers subsidy burn but reduces short-term GMV.
fraud_control_improvement,risk_upside,0.99,0.997,1.0,0.9,0.74,0.6,0.72,0.65,0.03,0.35,Stricter fraud controls and review friction suppress disputes/chargebacks with modest conversion drag.
downside_high_risk_deterioration,downside,1.035,0.992,1.08,1.22,1.3,1.28,1.35,1.4,0.0,0.0,Risky cohorts expand faster; refunds/disputes/chargebacks worsen despite topline growth.
